{
  "schema": "AIFC/entailment-question-source-binding/v1",
  "binding_id": "AIFC-SAL-V1.8-ENTAILMENT-QUESTION-SOURCE-BINDING-V1",
  "entailment_question_id": "994c979c702b81a0940f28b8039ad36cb48060c426f42eb1f333bf1630e473b6",
  "predecessor_artifact_id": "AIFC-RELEASE-GATE-v1.0.9-draft",
  "predecessor_git_blob_sha1": "e46cfee9963e61a22bc25e4e68ac5f11781e8d47",
  "predecessor_raw_sha256": null,
  "target_profile_id": "AIFC-LINEAGE-TRANSITION-PROFILE-V1",
  "target_profile_git_blob_sha1": "f096dbbb6d6382f58b3f2bbd3b7ad170b46d5e1b",
  "target_profile_raw_sha256": null,
  "binding_status": "NOT_ESTABLISHED_RAW_SHA256_MISSING",
  "binding_content_hash": "817e77196258b82f0b49a0886f603dd4622b5b994e0c2857ecf5d8c2056e9d2b"
}
